{
  "$schema": "./config-schema.json",
  "serverURL": "https://bizerba-bss-dev.com/",
  "defaultLanguage": "en-US",
  "availableLanguages": [
    "de",
    "en",
    "en-US"
  ],
  "restApiVersion": "1",
  "wsURL": "https://bizerba-bss-dev.com/notificationHub/notificationHub",
  "logOutURL": "https://bizerba-bss-dev.com/logout",
  "versioning": [
    {
      "name": "biss-saas-fe",
      "versionNumber": "20220527.1"
    },
    {
      "name": "mtm-api",
      "versionNumber": "0.2.0.7"
    },
    {
      "name": "notificationservice",
      "versionNumber": "0.0.2"
    }
  ]
}
