{
    "$schema": "../../../../schemas/config-schema.json",
    "serverURL": "http://localhost:8888/",
    "defaultLanguage": "en-US",
    "availableLanguages": ["de", "en", "en-US"],
    "restApiVersion": "1",
    "wsURL": "http://localhost:8080/notificationHub",
    "logOutURL": "https://bizerbab2cdev.b2clogin.com/bizerbab2cdev.onmicrosoft.com/b2c_1a_signup_signin2_es/oauth2/v2.0/logout?post_logout_redirect_uri=https://bizerba-bss-low.com",
    "versioning": [
        { "name": "biss-saas-fe", "versionNumber": "0.1.0.157" },
        { "name": "mtm-api", "versionNumber": "RC-0.3.0.24" },
        { "name": "notificationservice", "versionNumber": "0.0.2" }
    ]
}
