{
    "$schema": "./config-schema.json",
    "serverURL": "https://bizerba-bss-dev.com/",
    "defaultLanguage": "en-US",
    "availableLanguages": ["de", "en", "en-US"],
    "restApiVersion": "1",
    "wsURL": "https://bizerba-bss-dev.com/notificationHub/notificationHub",
    "logOutURL": "https://bizerba-bss-dev.com/logout",
    "versioning": [
        { "name": "tenant-management", "versionNumber": "0.1.0.53" },
        { "name": "mtm-api", "versionNumber": "RC-0.3.0.19" },
        { "name": "notificationservice", "versionNumber": "0.0.2" }
    ]
}