{
    "$schema": "../../../../schemas/config-schema.json",
    "serverURL": "https://bizerba-bss-dev.com/",
    "defaultLanguage": "en-US",
    "availableLanguages": ["de", "en", "en-US"],
    "restApiVersion": "1",
    "wsURL": "https://bizerba-bss-dev.com/notificationHub/notificationHub",
    "logOutURL": "https://bizerbab2cdev.b2clogin.com/bizerbab2cdev.onmicrosoft.com/b2c_1a_signup_signin2_es/oauth2/v2.0/logout?post_logout_redirect_uri=https://bizerba-bss-low.com",
    "versioning": [
        { "name": "biss-saas-fe", "versionNumber": "20220527.1" },
        { "name": "mtm-api", "versionNumber": "0.2.0.7" },
        { "name": "notificationservice", "versionNumber": "0.0.2" }
    ]
}
